{
  "name": "gdelt-seasonal-names-v1",
  "strip_person_titles": true,
  "strip_person_initials": false,
  "strip_person_suffixes": false,
  "organization_blocklist": [],
  "person_aliases": {},
  "organization_aliases": {},
  "evaluation": {
    "training_articles": 1059,
    "validation_articles": 1322,
    "reference": "CHANGELOG.md#seasonal-development",
    "method": "Training-only frequent-name exclusions and unambiguous overlapping-name aliases; selection averages normalized person/organization F1 for medium and large models.",
    "organization_filter": {
      "training_mentions": 6611,
      "positive_mentions": 1159,
      "features": 5465,
      "feature_minimum_mentions": 8,
      "models": [
        "md",
        "lg"
      ],
      "method": "Binary word/bigram/character features; L2 logistic regression trained against per-article native name presence; development validation threshold selection; runtime uses recorded linear coefficients only.",
      "regularization_c": 0.2,
      "probability_threshold": 0.15
    }
  },
  "organization_weights": {
    "b:air force": -0.2353450847717041,
    "b:and customs": -0.0012559577436972395,
    "b:and human": -0.16710158953133206,
    "b:and technology": -0.09130181613783561,
    "b:associated press": 0.37347406708659,
    "b:association of": -0.04283843680156588,
    "b:australian associated": -0.7938774823539478,
    "b:b c": -0.023486454732402604,
    "b:bank of": -0.34708616171403023,
    "b:board of": -0.097270600795213,
    "b:bureau of": 0.19213875676219364,
    "b:center for": -0.34316222459966333,
    "b:chamber of": -0.14367293944321807,
    "b:city council": 0.11487614685251311,
    "b:college of": 0.3393688096551145,
    "b:court of": -0.35889737399546057,
    "b:customs enforcement": -0.006468122555624408,
    "b:department of": 0.17054890792164082,
    "b:district court": 0.15708111207701475,
    "b:european union": 0.3824951491951422,
    "b:fire and": -0.01699463746662841,
    "b:free press": -0.07549486609281267,
    "b:gallery credit": -0.07171830738669668,
    "b:general hospital": -0.08607080364253854,
    "b:hall of": -0.026964002558655043,
    "b:health and": -0.16972440788774182,
    "b:high school": 0.20299209162250573,
    "b:homeland security": 0.05108070294808042,
    "b:house of": -0.1989062492198815,
    "b:human services": -0.24307241865010024,
    "b:immigration and": -0.0012559577436972395,
    "b:institute for": -0.012269517889491105,
    "b:institute of": 0.5152375195295453,
    "b:justice department": 0.34847274856535293,
    "b:kaduna state": 0.2483970680776375,
    "b:latest news": -0.012112430460665024,
    "b:local government": -0.03125175229740047,
    "b:los angeles": 0.20995660959577947,
    "b:medical center": 0.3259189926520778,
    "b:ministry of": 0.07479479298483573,
    "b:national guard": 0.3497348964245573,
    "b:national park": 0.14812685624972377,
    "b:new york": 0.12320022730793927,
    "b:of commerce": -0.14453581084858944,
    "b:of education": 0.036493384824727935,
    "b:of fame": -0.03835451671395704,
    "b:of health": -0.31930721462348544,
    "b:of homeland": 0.2368064803066064,
    "b:of representatives": -0.06616471853342064,
    "b:of the": 0.32431016162641596,
    "b:office for": -0.13016852785198296,
    "b:office of": 0.00121244853679823,
    "b:police department": -0.18026693494829593,
    "b:red bull": 0.12794902322867233,
    "b:s department": -0.1655881155717392,
    "b:school of": 0.23768154559342627,
    "b:security plus": -0.025771664901386104,
    "b:social security": -0.13625503220120572,
    "b:state department": -0.36053065954174035,
    "b:state university": 0.19754391081127745,
    "b:supreme court": 0.41402494726013633,
    "b:task force": -0.11064669309081329,
    "b:truth social": -0.01426395107606395,
    "b:u s": 0.1982238957176923,
    "b:ultimate security": -0.05056630948656946,
    "b:university of": 0.33282492751019305,
    "b:warner bros": 0.13196720617371613,
    "b:white house": 0.7743741075287012,
    "b:york times": 0.6912490772229127,
    "c:'s$": -1.1996318817474114,
    "c:00$": -0.05900822984412773,
    "c:025": -0.02446320712901165,
    "c:025$": -0.02028051476799431,
    "c:026": -0.15135245147454746,
    "c:026$": -0.1477269889854097,
    "c:20$": -0.07304217317861547,
    "c:202": -0.21883733776696482,
    "c:2025": -0.02446320712901165,
    "c:2026": -0.15135245147454746,
    "c:25$": -0.06758612165486227,
    "c:26$": -0.19754957076965476,
    "c:50$": -0.09274498092065973,
    "c:65$": -0.13827969269511586,
    "c:96$": -0.039755088085606974,
    "c:^-$": -0.3077738763371693,
    "c:^1$": -0.10229739114781243,
    "c:^10": -0.07904564077499343,
    "c:^2$": -0.14890121224984273,
    "c:^20": -0.2571932035334159,
    "c:^202": -0.21537321626712552,
    "c:^4$": -0.0871076017820553,
    "c:^5$": -0.10420740084546212,
    "c:^7$": -0.08469338364133011,
    "c:^a$": -0.256738208375758,
    "c:^aa": -0.019376733265933872,
    "c:^ab": -0.19794104273817914,
    "c:^abc": -0.035727754137847095,
    "c:^ac": -0.0188342091884967,
    "c:^aca": 0.13989880866133372,
    "c:^acc": -0.1507333840311755,
    "c:^act": 0.05378333213586435,
    "c:^ad": 0.024823587062005714,
    "c:^add": -0.05625568422495424,
    "c:^adm": 0.0711467172963254,
    "c:^adv": -0.023899210217007947,
    "c:^af": -0.14766964881079095,
    "c:^aff": 0.08253520489395949,
    "c:^afr": -0.06380097443815602,
    "c:^ag": 0.19110427880472725,
    "c:^age": 0.380606938099899,
    "c:^agr": 0.008390033232867796,
    "c:^ai": 0.016358675661844645,
    "c:^ai$": -0.14702278501282132,
    "c:^aii": -0.035111802228263884,
    "c:^air": 0.24872491261299778,
    "c:^ak": 0.16268908854791234,
    "c:^al": -0.04478139039187328,
    "c:^ala": -0.02458198221947953,
    "c:^alb": 0.1387379749017946,
    "c:^ale": -0.08889891829362491,
    "c:^all": -0.015743365728265936,
    "c:^am": -0.03815810545723062,
    "c:^ama": -0.09380747473837171,
    "c:^amb": -0.09161055945916102,
    "c:^ame": 0.07019807120385443,
    "c:^an": -0.7806248599423842,
    "c:^ana": -0.12593010665086093,
    "c:^and": -0.724381748837595,
    "c:^ang": 0.156342646650229,
    "c:^ani": -0.03358313520893769,
    "c:^ann": -0.08655682982251718,
    "c:^ant": 0.05826906089464981,
    "c:^ap": -0.16053546688577222,
    "c:^ap$": -0.06263701147310359,
    "c:^app": 0.056581266192183226,
    "c:^apr": -0.06275488197913195,
    "c:^ar": 0.10554758394425066,
    "c:^ara": -0.09332339770109499,
    "c:^are": 0.12715159392328643,
    "c:^ari": -0.15276949032324905,
    "c:^ark": 0.1214861981975298,
    "c:^arm": 0.1624888104596306,
    "c:^art": 0.09622901508079075,
    "c:^as": -0.0690176811763492,
    "c:^ash": -0.06310819452643295,
    "c:^asi": -0.11337035793453763,
    "c:^ass": 0.2853593395929148,
    "c:^at": 0.0972851303031579,
    "c:^at$": -0.06519845433139772,
    "c:^atl": 0.15330175253954867,
    "c:^au": -0.10914958837336616,
    "c:^aug": -0.01063498542218596,
    "c:^aus": -0.000715117241104325,
    "c:^aut": -0.03304464839350408,
    "c:^av": -0.18238668037566458,
    "c:^ave": -0.04916521026576957,
    "c:^aw": -0.048267646806761356,
    "c:^awa": -0.03052434292737091,
    "c:^az": -0.10729738421637863,
    "c:^b$": 0.0198360934283339,
    "c:^ba": 0.12731716984755476,
    "c:^bab": -0.0683237935619426,
    "c:^bac": -0.211331378210688,
    "c:^bal": -0.09874462339464342,
    "c:^ban": 0.10348319054959212,
    "c:^bap": 0.08780665979317455,
    "c:^bar": -0.14542507222987275,
    "c:^bas": 0.035861321339416004,
    "c:^bat": 0.08482496671615432,
    "c:^bay": 0.060736337655927536,
    "c:^bb": -0.14403612740875385,
    "c:^bbc": -0.047459630903885525,
    "c:^be": 0.14666595207307917,
    "c:^bea": 0.06890108930514038,
    "c:^bee": 0.06196952988889944,
    "c:^bel": 0.16426512910319885,
    "c:^ben": 0.10044129280284639,
    "c:^ber": -0.18102318950882806,
    "c:^bes": -0.16195852659826057,
    "c:^bi": -0.08100551599891882,
    "c:^big": -0.020594331567592966,
    "c:^bit": -0.0471960566526968,
    "c:^bl": -0.1854524269875797,
    "c:^bla": -0.15335796207463245,
    "c:^blo": 0.09074129695590177,
    "c:^blu": -0.018141080113811586,
    "c:^bo": -0.3727440993922906,
    "c:^boa": -0.08769022638989103,
    "c:^bod": -0.05676422572178717,
    "c:^bol": -0.06961062673266376,
    "c:^bon": -0.0304850896201874,
    "c:^boo": -0.05451189220656766,
    "c:^bor": -0.06103500023850093,
    "c:^bou": -0.08284866862142402,
    "c:^bow": -0.04072813450602596,
    "c:^box": 0.05679646946751675,
    "c:^br": 0.3289429359358265,
    "c:^bra": 0.055060135880033924,
    "c:^bre": 0.16069743356594135,
    "c:^bri": 0.13562518361471934,
    "c:^bro": 0.10170685336812459,
    "c:^bu": 0.3220521080983377,
    "c:^bud": -0.0686886043919706,
    "c:^buf": 0.043702822360731,
    "c:^bul": 0.0882707177099167,
    "c:^bur": 0.35029006600745327,
    "c:^bus": -0.051194407944468855,
    "c:^c$": -0.1855431158211546,
    "c:^ca": -0.05579352080356007,
    "c:^cab": 0.051394546047076634,
    "c:^caf": -0.037430163720576455,
    "c:^cal": -0.20615451537442667,
    "c:^cam": 0.06965457531687488,
    "c:^can": 0.0348403466196497,
    "c:^cap": 0.04324437612206739,
    "c:^car": -0.09421196037729664,
    "c:^cas": -0.0014689561889823215,
    "c:^cat": 0.06990374094826836,
    "c:^ce": 0.3026645697670921,
    "c:^cel": -0.05030233136907945,
    "c:^cen": 0.5300098854416821,
    "c:^cer": -0.08813890735056079,
    "c:^ch": 0.0004335702079443898,
    "c:^cha": -0.2017033247229595,
    "c:^che": -0.002970173275781024,
    "c:^chi": 0.15110321479577893,
    "c:^cho": -0.08324029942434015,
    "c:^chr": -0.06194152776459837,
    "c:^chu": 0.17328869679666992,
    "c:^ci": -0.25676711502978167,
    "c:^cin": -0.03530915838488833,
    "c:^cir": 0.04026788525268553,
    "c:^cit": -0.14311938467413607,
    "c:^civ": -0.08794284069212552,
    "c:^cl": 0.39903042488716867,
    "c:^cla": -0.08387592540388085,
    "c:^cle": 0.05515604282587768,